{
  "query_id": "QUERY001",
  "source_excel": "/mnt/data/repeat_case_m72/repeat_case_engine_v2_m7_1/input/new_cases.xlsx",
  "sheet_name": "待分析问题",
  "excel_row": 2,
  "raw_fields": {
    "查询编号": "QUERY001",
    "ITR单号": "ITR-NEW-001",
    "IPMT": "IPMT-A",
    "SPDT": "SPDT-A",
    "责任部门（二级）": "软件部",
    "产品": "产品A",
    "领域": "通信",
    "问题描述": "CAN报文过多时软件异常重启",
    "原因描述": "接收队列拥堵导致任务阻塞",
    "原因一级分类": "软件设计",
    "原因二级分类": "资源管理",
    "原因三级分类": "消息队列",
    "原因四级分类": "CAN接收缓存",
    "纠正措施": "增加队列水位监控",
    "预防措施": "增加报文限流和压力测试",
    "备注": "M7.1示例"
  },
  "mapped_fields": {
    "itr_id": "ITR-NEW-001",
    "ipmt": "IPMT-A",
    "spdt": "SPDT-A",
    "responsible_department_level2": "软件部",
    "product": "产品A",
    "domain": "通信",
    "problem_description": "CAN报文过多时软件异常重启",
    "cause_description": "接收队列拥堵导致任务阻塞",
    "cause_level1": "软件设计",
    "cause_level2": "资源管理",
    "cause_level3": "消息队列",
    "cause_level4": "CAN接收缓存",
    "corrective_action": "增加队列水位监控",
    "preventive_action": "增加报文限流和压力测试",
    "remark": "M7.1示例"
  },
  "parse_status": "SUCCESS",
  "parse_warnings": [],
  "parser_version": "2.0.0-m7.1",
  "generated_at": "2026-07-23T01:22:23.731658+00:00"
}